{
  "schema_version": "mcp.request.v0.1",
  "request_id": "req-001",
  "tool": {
    "name": "a11y-assist.explain",
    "version": "v0.3.1"
  },
  "params": {
    "profile": "screen-reader",
    "_meta": {
      "capture_provenance": true,
      "capture_artifacts": true
    }
  },
  "artifacts": [
    {
      "schema_version": "artifact.ref.v0.1",
      "locator": "file:/tmp/cli_error.json",
      "media_type": "application/json",
      "labels": {
        "role": "cli_error_json"
      }
    }
  ],
  "preferences": {
    "deterministic": true
  }
}
